[
  {"id":"public_normal","demand_multipliers":[0.72,0.68,0.65,0.64,0.68,0.78,0.92,1.08,1.15,1.12,1.05,1.00,1.04,1.08,1.10,1.12,1.18,1.28,1.32,1.24,1.10,0.96,0.84,0.76],"tariff":[0.10,0.10,0.10,0.10,0.10,0.10,0.14,0.18,0.22,0.22,0.18,0.16,0.16,0.16,0.18,0.22,0.30,0.30,0.30,0.24,0.20,0.16,0.12,0.10],"initial_tank_offsets_m":{"1":0,"2":0,"3":0},"leak":null},
  {"id":"public_peak","demand_multipliers":[0.75,0.70,0.68,0.67,0.72,0.84,1.02,1.22,1.34,1.30,1.17,1.08,1.10,1.14,1.18,1.23,1.32,1.44,1.48,1.38,1.20,1.02,0.90,0.80],"tariff":[0.08,0.08,0.08,0.08,0.08,0.10,0.14,0.20,0.28,0.28,0.22,0.18,0.18,0.18,0.22,0.28,0.36,0.36,0.36,0.30,0.22,0.16,0.10,0.08],"initial_tank_offsets_m":{"1":0.2,"2":0.1,"3":0.1},"leak":null},
  {"id":"public_low_storage","demand_multipliers":[0.70,0.68,0.66,0.65,0.70,0.82,0.98,1.14,1.20,1.16,1.08,1.02,1.05,1.10,1.13,1.18,1.24,1.34,1.38,1.30,1.16,1.00,0.88,0.78],"tariff":[0.10,0.10,0.10,0.10,0.10,0.12,0.16,0.22,0.28,0.28,0.20,0.17,0.17,0.17,0.20,0.25,0.32,0.32,0.32,0.26,0.20,0.16,0.12,0.10],"initial_tank_offsets_m":{"1":-0.4,"2":-0.5,"3":-0.5},"leak":null}
]
